{
  "name": "core",
  "version": "0.1.0",
  "description": "Core skills that help AI agents properly operate in repositories. Includes temporary file management with examples for Bash, Python, Node.js, Go, and Ruby.",
  "keywords": [
    "agent-skills",
    "temporary-files",
    "file-management",
    "best-practices",
    "bash",
    "python",
    "node.js",
    "go",
    "ruby"
  ],
  "author": {
    "name": "Javier Alvarez",
    "email": "jalvarezsamayoa@gmail.com"
  },
  "repository": "https://github.com/jalvarezsamayoa/vscode-copilot-plugins",
  "homepage": "https://github.com/jalvarezsamayoa/vscode-copilot-plugins/tree/main/plugins/core",
  "license": "MIT"
}
